{
  "$schema": "https://json-schema.org/draft/2020-12/schema",
  "$id": "https://raw.githubusercontent.com/pingta-guangpingwang/wgp-agent-bodification-flow/v0.6.0/spec/assembly-recipe.schema.json",
  "title": "WGP-ABF Assembly Recipe v0.6",
  "description": "A versioned, hash-addressed selection of implementations, bindings, placements, and runtime settings for one WGP-ABIR document.",
  "type": "object",
  "required": [
    "format",
    "id",
    "name",
    "version",
    "contentHash",
    "createdAt",
    "abir",
    "standardPartBindings",
    "contractBindings",
    "componentBindings",
    "resourceBindings",
    "policyBindings",
    "containerPlacements",
    "interfaceBindings",
    "runtime",
    "verificationPlan"
  ],
  "properties": {
    "format": { "const": "wgp-assembly-recipe/0.6" },
    "id": { "$ref": "#/$defs/id" },
    "name": { "$ref": "#/$defs/localizedText" },
    "version": { "$ref": "#/$defs/semver" },
    "contentHash": {
      "description": "SHA-256 of RFC 8785 canonical JSON with this root contentHash member omitted.",
      "$ref": "#/$defs/contentHash"
    },
    "createdAt": { "$ref": "#/$defs/timestamp" },
    "abir": {
      "type": "object",
      "required": ["id", "version", "contentHash"],
      "properties": {
        "id": { "$ref": "#/$defs/id" },
        "version": { "$ref": "#/$defs/semver" },
        "contentHash": { "$ref": "#/$defs/contentHash" }
      },
      "additionalProperties": false
    },
    "standardPartBindings": {
      "description": "Exact StandardPartDescriptor pins and explicit mappings from standardized surface ports to ABIR object ports.",
      "type": "array",
      "minItems": 1,
      "items": { "$ref": "#/$defs/standardPartBinding" }
    },
    "contractBindings": {
      "type": "array",
      "minItems": 1,
      "items": { "$ref": "#/$defs/contractBinding" }
    },
    "componentBindings": {
      "type": "array",
      "items": { "$ref": "#/$defs/componentBinding" }
    },
    "resourceBindings": {
      "type": "array",
      "items": { "$ref": "#/$defs/resourceBinding" }
    },
    "policyBindings": {
      "type": "array",
      "items": { "$ref": "#/$defs/policyBinding" }
    },
    "containerPlacements": {
      "type": "array",
      "items": { "$ref": "#/$defs/containerPlacement" }
    },
    "interfaceBindings": {
      "type": "array",
      "items": { "$ref": "#/$defs/interfaceBinding" }
    },
    "runtime": { "$ref": "#/$defs/runtime" },
    "verificationPlan": {
      "description": "Checks to execute after assembly. Definitions are not evidence of execution or success; executed evidence belongs in a ConformanceReport.",
      "type": "array",
      "items": { "$ref": "#/$defs/verificationDefinition" }
    },
    "metadata": {
      "type": "object",
      "propertyNames": { "pattern": "^[A-Za-z][A-Za-z0-9._:-]*$" },
      "additionalProperties": {
        "oneOf": [
          { "type": "string" },
          { "type": "number" },
          { "type": "boolean" },
          { "type": "null" }
        ]
      }
    }
  },
  "additionalProperties": false,
  "$defs": {
    "id": {
      "type": "string",
      "pattern": "^[A-Za-z][A-Za-z0-9._:-]{0,127}$"
    },
    "semver": {
      "type": "string",
      "pattern": "^(0|[1-9][0-9]*)\\.(0|[1-9][0-9]*)\\.(0|[1-9][0-9]*)(?:-[0-9A-Za-z.-]+)?(?:\\+[0-9A-Za-z.-]+)?$"
    },
    "timestamp": { "type": "string", "format": "date-time" },
    "contentHash": {
      "type": "string",
      "pattern": "^sha256:[a-f0-9]{64}$"
    },
    "localizedText": {
      "type": "object",
      "minProperties": 1,
      "properties": {
        "zh-CN": { "type": "string", "minLength": 1 },
        "en": { "type": "string", "minLength": 1 }
      },
      "additionalProperties": false
    },
    "configObject": {
      "description": "Implementation-owned JSON configuration. Validation is delegated to the referenced component or provider schema.",
      "type": "object"
    },
    "exactPartRef": {
      "type": "object",
      "required": ["partId", "version", "contentHash"],
      "properties": {
        "partId": { "$ref": "#/$defs/id" },
        "version": { "$ref": "#/$defs/semver" },
        "contentHash": { "$ref": "#/$defs/contentHash" }
      },
      "additionalProperties": false
    },
    "exactDocumentRef": {
      "type": "object",
      "required": ["id", "version", "contentHash"],
      "properties": {
        "id": { "$ref": "#/$defs/id" },
        "version": { "$ref": "#/$defs/semver" },
        "contentHash": { "$ref": "#/$defs/contentHash" }
      },
      "additionalProperties": false
    },
    "exactContractRef": {
      "type": "object",
      "required": ["contractId", "version", "contentHash"],
      "properties": {
        "contractId": { "$ref": "#/$defs/id" },
        "version": { "$ref": "#/$defs/semver" },
        "contentHash": { "$ref": "#/$defs/contentHash" }
      },
      "additionalProperties": false
    },
    "partKind": {
      "enum": ["component", "resource", "policy", "artifact", "interface", "container"]
    },
    "portMapping": {
      "type": "object",
      "required": ["assemblyBindingId", "abirPortId"],
      "properties": {
        "assemblyBindingId": { "$ref": "#/$defs/id" },
        "abirPortId": { "$ref": "#/$defs/id" }
      },
      "additionalProperties": false
    },
    "surfaceMapping": {
      "type": "object",
      "required": ["surfaceId", "portMappings"],
      "properties": {
        "surfaceId": { "$ref": "#/$defs/id" },
        "portMappings": {
          "type": "array",
          "minItems": 1,
          "items": { "$ref": "#/$defs/portMapping" }
        }
      },
      "additionalProperties": false
    },
    "standardPartBinding": {
      "type": "object",
      "required": [
        "bindingId",
        "descriptorRef",
        "packageRef",
        "partKind",
        "targetObjectId",
        "enabled",
        "config",
        "surfaceMappings"
      ],
      "properties": {
        "bindingId": { "$ref": "#/$defs/id" },
        "descriptorRef": { "$ref": "#/$defs/exactPartRef" },
        "packageRef": { "$ref": "#/$defs/exactDocumentRef" },
        "partKind": { "$ref": "#/$defs/partKind" },
        "targetObjectId": { "$ref": "#/$defs/id" },
        "enabled": { "type": "boolean" },
        "config": { "$ref": "#/$defs/configObject" },
        "surfaceMappings": {
          "type": "array",
          "minItems": 1,
          "items": { "$ref": "#/$defs/surfaceMapping" }
        }
      },
      "additionalProperties": false
    },
    "contractBindingParty": {
      "type": "object",
      "properties": {
        "standardPartBindingId": { "$ref": "#/$defs/id" },
        "surfaceId": { "$ref": "#/$defs/id" },
        "assemblyBindingId": { "$ref": "#/$defs/id" },
        "abirObjectId": { "$ref": "#/$defs/id" },
        "abirPortId": { "$ref": "#/$defs/id" }
      },
      "oneOf": [
        {
          "required": ["standardPartBindingId", "surfaceId", "assemblyBindingId"],
          "properties": {
            "standardPartBindingId": { "$ref": "#/$defs/id" },
            "surfaceId": { "$ref": "#/$defs/id" },
            "assemblyBindingId": { "$ref": "#/$defs/id" },
            "abirObjectId": false,
            "abirPortId": false
          }
        },
        {
          "description": "A Contract-typed ABIR boundary port whose counterpart is not packaged as a Standard Part in this Recipe.",
          "required": ["abirObjectId", "abirPortId"],
          "properties": {
            "abirObjectId": { "$ref": "#/$defs/id" },
            "abirPortId": { "$ref": "#/$defs/id" },
            "standardPartBindingId": false,
            "surfaceId": false,
            "assemblyBindingId": false
          }
        }
      ],
      "additionalProperties": false
    },
    "contractBinding": {
      "type": "object",
      "required": ["contractBindingId", "producer", "consumer", "resolution"],
      "properties": {
        "contractBindingId": { "$ref": "#/$defs/id" },
        "producer": { "$ref": "#/$defs/contractBindingParty" },
        "consumer": { "$ref": "#/$defs/contractBindingParty" },
        "resolution": {
          "type": "object",
          "required": ["mode"],
          "properties": {
            "mode": { "enum": ["exact", "compatible", "adapter"] },
            "compatibilityAssessmentRef": { "$ref": "#/$defs/exactDocumentRef" },
            "adapterArtifactRef": {
              "type": "object",
              "required": ["artifactId", "version", "contentHash"],
              "properties": {
                "artifactId": { "$ref": "#/$defs/id" },
                "version": { "$ref": "#/$defs/semver" },
                "contentHash": { "$ref": "#/$defs/contentHash" }
              },
              "additionalProperties": false
            },
            "migrationPlanRef": { "$ref": "#/$defs/exactDocumentRef" }
          },
          "allOf": [
            {
              "if": {
                "properties": { "mode": { "const": "exact" } },
                "required": ["mode"]
              },
              "then": {
                "properties": {
                  "compatibilityAssessmentRef": false,
                  "adapterArtifactRef": false,
                  "migrationPlanRef": false
                }
              }
            },
            {
              "if": {
                "properties": { "mode": { "const": "compatible" } },
                "required": ["mode"]
              },
              "then": {
                "properties": {
                  "compatibilityAssessmentRef": { "$ref": "#/$defs/exactDocumentRef" },
                  "adapterArtifactRef": false,
                  "migrationPlanRef": false
                },
                "required": ["compatibilityAssessmentRef"]
              }
            },
            {
              "if": {
                "properties": { "mode": { "const": "adapter" } },
                "required": ["mode"]
              },
              "then": { "required": ["compatibilityAssessmentRef", "adapterArtifactRef", "migrationPlanRef"] }
            }
          ],
          "additionalProperties": false
        }
      },
      "additionalProperties": false
    },
    "componentBinding": {
      "type": "object",
      "required": ["componentId", "implementationArtifactId", "enabled", "config"],
      "properties": {
        "componentId": { "$ref": "#/$defs/id" },
        "implementationArtifactId": { "$ref": "#/$defs/id" },
        "enabled": { "type": "boolean" },
        "config": { "$ref": "#/$defs/configObject" }
      },
      "additionalProperties": false
    },
    "resourceBinding": {
      "type": "object",
      "required": ["resourceId", "provider", "settings", "credentialRefs"],
      "properties": {
        "resourceId": { "$ref": "#/$defs/id" },
        "provider": { "type": "string", "minLength": 1 },
        "artifactId": { "$ref": "#/$defs/id" },
        "endpoint": { "type": "string", "format": "uri" },
        "settings": { "$ref": "#/$defs/configObject" },
        "credentialRefs": {
          "description": "Names or opaque identifiers only; recipes must not embed credential values.",
          "type": "array",
          "uniqueItems": true,
          "items": { "$ref": "#/$defs/id" }
        }
      },
      "additionalProperties": false
    },
    "policyBinding": {
      "type": "object",
      "required": ["policyId", "enforcedBy", "mode"],
      "properties": {
        "policyId": { "$ref": "#/$defs/id" },
        "enforcedBy": {
          "type": "array",
          "minItems": 1,
          "uniqueItems": true,
          "items": { "$ref": "#/$defs/id" }
        },
        "mode": { "enum": ["enforce", "audit", "disabled"] }
      },
      "additionalProperties": false
    },
    "containerPlacement": {
      "type": "object",
      "required": ["containerId", "objectIds"],
      "properties": {
        "containerId": { "$ref": "#/$defs/id" },
        "objectIds": {
          "type": "array",
          "minItems": 1,
          "uniqueItems": true,
          "items": { "$ref": "#/$defs/id" }
        },
        "limits": {
          "type": "object",
          "properties": {
            "cpu": { "type": "number", "exclusiveMinimum": 0 },
            "memoryMiB": { "type": "integer", "minimum": 1 },
            "timeoutMs": { "type": "integer", "minimum": 1 }
          },
          "additionalProperties": false
        }
      },
      "additionalProperties": false
    },
    "interfaceBinding": {
      "type": "object",
      "required": ["interfaceId", "enabled", "settings"],
      "properties": {
        "interfaceId": { "$ref": "#/$defs/id" },
        "enabled": { "type": "boolean" },
        "settings": { "$ref": "#/$defs/configObject" }
      },
      "additionalProperties": false
    },
    "runtime": {
      "type": "object",
      "required": ["engine", "entryComponentId", "environment", "startup", "restartPolicy"],
      "properties": {
        "engine": {
          "type": "object",
          "required": ["name", "version"],
          "properties": {
            "name": { "type": "string", "minLength": 1 },
            "version": { "type": "string", "minLength": 1 },
            "artifactId": { "$ref": "#/$defs/id" }
          },
          "additionalProperties": false
        },
        "entryComponentId": { "$ref": "#/$defs/id" },
        "environment": {
          "type": "object",
          "required": ["requiredVariables", "optionalVariables"],
          "properties": {
            "requiredVariables": {
              "type": "array",
              "uniqueItems": true,
              "items": { "type": "string", "pattern": "^[A-Z_][A-Z0-9_]*$" }
            },
            "optionalVariables": {
              "type": "array",
              "uniqueItems": true,
              "items": { "type": "string", "pattern": "^[A-Z_][A-Z0-9_]*$" }
            }
          },
          "additionalProperties": false
        },
        "startup": {
          "type": "object",
          "required": ["command", "arguments"],
          "properties": {
            "command": { "type": "string", "minLength": 1 },
            "arguments": {
              "type": "array",
              "items": { "type": "string" }
            },
            "workingDirectory": { "type": "string", "minLength": 1 }
          },
          "additionalProperties": false
        },
        "restartPolicy": { "enum": ["never", "onFailure", "always", "manual"] }
      },
      "additionalProperties": false
    },
    "verificationDefinition": {
      "description": "A check definition awaiting execution; this object never asserts a passing result.",
      "type": "object",
      "required": ["id", "kind", "required"],
      "properties": {
        "id": { "$ref": "#/$defs/id" },
        "kind": { "enum": ["schema", "health", "smoke", "policy", "snapshot", "custom"] },
        "required": { "type": "boolean" },
        "command": { "type": "string", "minLength": 1 },
        "timeoutMs": { "type": "integer", "minimum": 1 },
        "expected": { "$ref": "#/$defs/configObject" }
      },
      "additionalProperties": false
    }
  }
}
